IndustryID,Code,Description,InsertedByUserID,InsertedDateTime,UpdatedByUserID,UpdatedDateTime,PSIC
869,28242,MANUFACTURE OF HEAVY MACHINERY AND EQUIPMENT USED FOR CONSTRUCTION,9998,2016-03-03 14:55:07.000,9998,2016-03-03 14:55:07.000,
870,2825,MANUFACTURE OF MACHINERY FOR FOOD BEVERAGE AND TOBACCO PROCESSING,9998,2016-03-03 14:55:07.000,9998,2016-03-03 14:55:07.000,
871,28251,MANUFACTURE OF MACHINERY FOR FOOD PROCESSING,9998,2016-03-03 14:55:07.000,9998,2016-03-03 14:55:07.000,
872,28252,"MANUFACTURE OF PRESSES, CRUSHERS AND SIMILAR MACHINERY USED TO MAKE WINE, CIDER, FRUIT JUICES OR SIMILAR BEVERAGES",9998,2016-03-03 14:55:07.000,9998,2016-03-03 14:55:07.000,
873,28253,"MANUFACTURE OF MACHINERY FOR THE PREPARATION OF TOBACCO AND FOR THE MAKING OF CIGARETTES OR CIGARS, OR PIPE OR CHEWING TOBACCO OR SNUFF",9998,2016-03-03 14:55:07.000,9998,2016-03-03 14:55:07.000,
874,2826,"MANUFACTURE OF MACHINERY FOR TEXTILE, APPAREL AND LEATHER PRODUCTION",9998,2016-03-03 14:55:07.000,9998,2016-03-03 14:55:07.000,
875,28261,MANUFACTURE OF TEXTILE MACHINERY,9998,2016-03-03 14:55:07.000,9998,2016-03-03 14:55:07.000,
876,28262,MANUFACTURE OF MACHINERIES FOR MAN-MADE TEXTILE FIBERS OR YARNS,9998,2016-03-03 14:55:07.000,9998,2016-03-03 14:55:07.000,
877,28263,MANUFACTURE OF SEWING MACHINES,9998,2016-03-03 14:55:07.000,9998,2016-03-03 14:55:07.000,
878,28264,"MANUFACTURE OF WASHING, LAUNDRY, DRY-CLEANING AND PRESSING MACHINES",9998,2016-03-03 14:55:07.000,9998,2016-03-03 14:55:07.000,
879,28265,"MANUFACTURE OF NEEDLES FOR KNITTING, SEWING MACHINES",9998,2016-03-03 14:55:07.000,9998,2016-03-03 14:55:07.000,
880,28269,"MANUFACTURE OF MACHINERY FOR TEXTILE APPAREL AND LEATHER PRODUCTION, N.E.C.",9998,2016-03-03 14:55:07.000,9998,2016-03-03 14:55:07.000,
881,2829,MANUFACTURE OF OTHER SPECIAL-PURPOSE MACHINERY,9998,2016-03-03 14:55:07.000,9998,2016-03-03 14:55:07.000,
882,28291,"MANUFACTURE OF MACHINERY FOR PULP, PAPER AND PAPERBOARD INDUSTRIES",9998,2016-03-03 14:55:07.000,9998,2016-03-03 14:55:07.000,
883,28292,MANUFACTURE OF MACHINERY FOR WORKING RUBBER OR PLASTIC OR FOR THE MANUFACTURE OF PRODUCTS OF THESE MATERIALS,9998,2016-03-03 14:55:07.000,9998,2016-03-03 14:55:07.000,
884,28293,MANUFACTURE OF PRINTING-TRADE MACHINERY AND EQUIPMENT,9998,2016-03-03 14:55:07.000,9998,2016-03-03 14:55:07.000,
885,28294,"MANUFACTURE OF MACHINERY FOR PRODUCING TILES, BRICKS, SHAPED CERAMIC PASTES, PIPES, GRAPHITE, ELECTRODES, BLACKBOARD CHALK, FOUNDRY MOLDS, ETC.",9998,2016-03-03 14:55:07.000,9998,2016-03-03 14:55:07.000,
886,28295,MANUFACTURE OF MACHINES FOR PRODUCTION OR HOT-WORKING OF GLASS; GLASSWARE OR YARN,9998,2016-03-03 14:55:07.000,9998,2016-03-03 14:55:07.000,
887,28296,MANUFACTURE OF CENTRIFUGAL CLOTHES DRIERS,9998,2016-03-03 14:55:07.000,9998,2016-03-03 14:55:07.000,
888,28299,"MANUFACTURE OF OTHER SPECIAL-PURPOSE MACHINERY, N.E.C.",9998,2016-03-03 14:55:07.000,9998,2016-03-03 14:55:07.000,
889,291,MANUFACTURE OF MOTOR VEHICLES,9998,2016-03-03 14:55:07.000,9998,2016-03-03 14:55:07.000,
890,2910,MANUFACTURE OF MOTOR VEHICLES,9998,2016-03-03 14:55:07.000,9998,2016-03-03 14:55:07.000,
891,29100,MANUFACTURE OF MOTOR VEHICLES,9998,2016-03-03 14:55:07.000,9998,2016-03-03 14:55:07.000,
892,292,MANUFACTURE OF BODIES (COACHWORK) FOR MOTOR VEHICLES; MANUFACTURE OF TRAILERS AND SEMI-TRAILERS,9998,2016-03-03 14:55:07.000,9998,2016-03-03 14:55:07.000,
893,2920,MANUFACTURE OF BODIES (COACHWORK) FOR MOTOR VEHICLES; MANUFACTURE OF TRAILERS AND SEMI-TRAILERS,9998,2016-03-03 14:55:07.000,9998,2016-03-03 14:55:07.000,
894,29201,MANUFACTURE OF BODIES (COACHWORK) FOR MOTOR VEHICLES,9998,2016-03-03 14:55:07.000,9998,2016-03-03 14:55:07.000,
895,29202,MANUFACTURE OF TRAILERS AND SEMI-TRAILERS,9998,2016-03-03 14:55:07.000,9998,2016-03-03 14:55:07.000,
896,293,MANUFACTURE OF PARTS AND ACCESSORIES FOR MOTOR VEHICLES,9998,2016-03-03 14:55:07.000,9998,2016-03-03 14:55:07.000,
897,2930,MANUFACTURE OF PARTS AND ACCESSORIES FOR MOTOR VEHICLES,9998,2016-03-03 14:55:07.000,9998,2016-03-03 14:55:07.000,
898,29301,MANUFACTURE OF ELECTRIC IGNITION OR STARTING EQUIPMENT FOR INTERNAL COMBUSTION ENGINES,9998,2016-03-03 14:55:07.000,9998,2016-03-03 14:55:07.000,
899,29302,MANUFACTURE OF PARTS AND ACCESSORIES FOR MOTOR VEHICLES AND THEIR ENGINES,9998,2016-03-03 14:55:07.000,9998,2016-03-03 14:55:07.000,
900,301,BUILDING OF SHIPS AND BOATS,9998,2016-03-03 14:55:07.000,9998,2016-03-03 14:55:07.000,
901,3011,BUILDING OF SHIPS AND FLOATING STRUCTURES,9998,2016-03-03 14:55:07.000,9998,2016-03-03 14:55:07.000,
902,30111,BUILDING OF SHIPS AND BOATS OTHER THAN SPORTS AND PLEASURE BOATS,9998,2016-03-03 14:55:07.000,9998,2016-03-03 14:55:07.000,
903,30112,MANUFACTURE OF FLOATING OR SUBMERSIBLE DRILLING PLATFORMS,9998,2016-03-03 14:55:07.000,9998,2016-03-03 14:55:07.000,
904,30113,MANUFACTURE OF INFLATABLE RAFTS,9998,2016-03-03 14:55:07.000,9998,2016-03-03 14:55:07.000,
905,30114,MANUFACTURE OF METAL SECTIONS FOR SHIPS AND BARGES,9998,2016-03-03 14:55:07.000,9998,2016-03-03 14:55:07.000,
906,3012,BUILDING OF PLEASURE AND SPORTING BOATS,9998,2016-03-03 14:55:07.000,9998,2016-03-03 14:55:07.000,
907,30121,MANUFACTURE OF INFLATABLE BOATS,9998,2016-03-03 14:55:07.000,9998,2016-03-03 14:55:07.000,
908,30129,"MANUFACTURE OF OTHER PLEASURE AND SPORTING BOATS, N.E.C.",9998,2016-03-03 14:55:07.000,9998,2016-03-03 14:55:07.000,
909,302,MANUFACTURE OF RAILWAY LOCOMOTIVE AND ROLLING STOCK,9998,2016-03-03 14:55:07.000,9998,2016-03-03 14:55:07.000,
910,3020,MANUFACTURE OF RAILWAY LOCOMOTIVE AND ROLLING STOCK,9998,2016-03-03 14:55:07.000,9998,2016-03-03 14:55:07.000,
911,30201,"BUILDING AND REBUILDING OF LOCOMOTIVES OF ANY TYPE OF GAUGE, AND RAILROAD AND TRAMWAY CARS FOR FREIGHT AND PASSENGER SERVICE",9998,2016-03-03 14:55:07.000,9998,2016-03-03 14:55:07.000,
912,30202,"PRODUCTION OF SPECIALIZED PARTS FOR LOCOMOTIVES, RAILROAD AND TRAMWAY",9998,2016-03-03 14:55:07.000,9998,2016-03-03 14:55:07.000,
913,303,MANUFACTURE OF AIR AND SPACECRAFT AND RELATED MACHINERY,9998,2016-03-03 14:55:07.000,9998,2016-03-03 14:55:07.000,
914,3030,MANUFACTURE OF AIR AND SPACECRAFT AND RELATED MACHINERY,9998,2016-03-03 14:55:07.000,9998,2016-03-03 14:55:07.000,
915,30300,MANUFACTURE OF AIR AND SPACECRAFT AND RELATED MACHINERY,9998,2016-03-03 14:55:07.000,9998,2016-03-03 14:55:07.000,
916,304,MANUFACTURE OF MILITARY FIGHTING VEHICLES,9998,2016-03-03 14:55:07.000,9998,2016-03-03 14:55:07.000,
917,3040,MANUFACTURE OF MILITARY FIGHTING VEHICLES,9998,2016-03-03 14:55:07.000,9998,2016-03-03 14:55:07.000,
918,30400,MANUFACTURE OF MILITARY FIGHTING VEHICLES,9998,2016-03-03 14:55:07.000,9998,2016-03-03 14:55:07.000,
919,309,"MANUFACTURE OF TRANSPORT EQUIPMENT, N.E.C.",9998,2016-03-03 14:55:07.000,9998,2016-03-03 14:55:07.000,
920,3091,MANUFACTURE OF MOTORCYLES,9998,2016-03-03 14:55:07.000,9998,2016-03-03 14:55:07.000,
921,30911,MANUFACTURE AND ASSEMBLY OF MOTORCYCLES,9998,2016-03-03 14:55:07.000,9998,2016-03-03 14:55:07.000,
922,30912,MANUFACTURE OF MOTORCYCLE ENGINES AND PARTS THEREOF,9998,2016-03-03 14:55:07.000,9998,2016-03-03 14:55:07.000,
923,30913,MANUFACTURE OF TRICYCLES AND PARTS THEREOF,9998,2016-03-03 14:55:07.000,9998,2016-03-03 14:55:07.000,
924,30914,MANUFACTURE OF SIDE CARS,9998,2016-03-03 14:55:07.000,9998,2016-03-03 14:55:07.000,
925,30915,MANUFACTURE OF PARTS AND ACCESSORIES OF MOTORCYLES,9998,2016-03-03 14:55:07.000,9998,2016-03-03 14:55:07.000,
926,3092,MANUFACTURE OF BICYCLES AND INVALID CARRIAGES,9998,2016-03-03 14:55:07.000,9998,2016-03-03 14:55:07.000,
927,30921,MANUFACTURE OF BICYCLES AND BICYCLE PARTS,9998,2016-03-03 14:55:07.000,9998,2016-03-03 14:55:07.000,
928,30922,"MANUFACTURE OF INVALID CARRIAGES, MOTORIZED AND NON-MOTORIZED",9998,2016-03-03 14:55:07.000,9998,2016-03-03 14:55:07.000,
929,30923,MANUFACTURE OF BABY CARRIAGES,9998,2016-03-03 14:55:07.000,9998,2016-03-03 14:55:07.000,
930,3099,"MANUFACTURE OF OTHER TRANSPORT EQUIPMENT, N.E.C",9998,2016-03-03 14:55:07.000,9998,2016-03-03 14:55:07.000,
931,30991,MANUFACTURE OF HAND-PROPELLED VEHICLES,9998,2016-03-03 14:55:07.000,9998,2016-03-03 14:55:07.000,
932,30992,MANUFACTURE OF ANIMAL DRAWN VEHICLES,9998,2016-03-03 14:55:07.000,9998,2016-03-03 14:55:07.000,
933,310,MANUFACTURE OF FURNITURE,9998,2016-03-03 14:55:07.000,9998,2016-03-03 14:55:07.000,
934,3101,MANUFACTURE OF WOOD FURNITURE,9998,2016-03-03 14:55:07.000,9998,2016-03-03 14:55:07.000,
935,31010,MANUFACTURE OF WOOD FURNITURE,9998,2016-03-03 14:55:07.000,9998,2016-03-03 14:55:07.000,
936,3102,"MANUFACTURE OF RATTAN FURNITURE (REED, WICKER, AND CANE)",9998,2016-03-03 14:55:07.000,9998,2016-03-03 14:55:07.000,
937,31020,"MANUFACTURE OF RATTAN FURNITURE (REED, WICKER, AND CANE)",9998,2016-03-03 14:55:07.000,9998,2016-03-03 14:55:07.000,
938,3103,MANUFACTURE OF BOX BEDS AND MATTRESSES,9998,2016-03-03 14:55:07.000,9998,2016-03-03 14:55:07.000,
939,31030,MANUFACTURE OF BOX BEDS AND MATTRESSES,9998,2016-03-03 14:55:07.000,9998,2016-03-03 14:55:07.000,
940,3104,"MANUFACTURE OF PARTITIONS, SHELVES, LOCKERS AND OFFICE AND STORE FIXTURES",9998,2016-03-03 14:55:07.000,9998,2016-03-03 14:55:07.000,
941,31040,"MANUFACTURE OF PARTITIONS, SHELVES, LOCKERS AND OFFICE AND STORE FIXTURES",9998,2016-03-03 14:55:07.000,9998,2016-03-03 14:55:07.000,
942,3105,MANUFACTURE OF PLASTIC FURNITURE,9998,2016-03-03 14:55:07.000,9998,2016-03-03 14:55:07.000,
943,31050,MANUFACTURE OF PLASTIC FURNITURE,9998,2016-03-03 14:55:07.000,9998,2016-03-03 14:55:07.000,
944,3106,MANUFACTURE OF FURNITURE AND FIXTURES OF METAL,9998,2016-03-03 14:55:07.000,9998,2016-03-03 14:55:07.000,
945,31060,MANUFACTURE OF FURNITURE AND FIXTURES OF METAL,9998,2016-03-03 14:55:07.000,9998,2016-03-03 14:55:07.000,
946,3109,"MANUFACTURE OF OTHER FURNITURE AND FIXTURES, N.E.C.",9998,2016-03-03 14:55:07.000,9998,2016-03-03 14:55:07.000,
947,31090,"MANUFACTURE OF OTHER FURNITURE AND FIXTURES, N.E.C.",9998,2016-03-03 14:55:07.000,9998,2016-03-03 14:55:07.000,
948,321,"MANUFACTURE OF JEWELRY, BIJOUTERIE AND RELATED ARTICLES",9998,2016-03-03 14:55:07.000,9998,2016-03-03 14:55:07.000,
949,3211,MANUFACTURE OF JEWELRY AND RELATED ARTICLES,9998,2016-03-03 14:55:07.000,9998,2016-03-03 14:55:07.000,
950,32111,MANUFACTURE OF JEWELRY MADE OF PRECIOUS AND SEMI-PRECIOUS STONES,9998,2016-03-03 14:55:07.000,9998,2016-03-03 14:55:07.000,
951,32112,MANUFACTURE OF SILVERWARE AND PLATED WARE,9998,2016-03-03 14:55:07.000,9998,2016-03-03 14:55:07.000,
952,32113,MANUFACTURE OF WATCHBANDS AND BRACELETS OF PRECIOUS METALS,9998,2016-03-03 14:55:07.000,9998,2016-03-03 14:55:07.000,
953,32119,MANUFACTURE OF ARTICLES RELATED TO JEWELRY,9998,2016-03-03 14:55:07.000,9998,2016-03-03 14:55:07.000,
954,3212,MANUFACTURE OF IMITATION OF JEWELRY AND RELATED ARTICLES,9998,2016-03-03 14:55:07.000,9998,2016-03-03 14:55:07.000,
955,32120,MANUFACTURE OF IMITATION OF JEWELRY AND RELATED ARTICLES,9998,2016-03-03 14:55:07.000,9998,2016-03-03 14:55:07.000,
956,322,MANUFACTURE OF MUSICAL INSTRUMENTS,9998,2016-03-03 14:55:07.000,9998,2016-03-03 14:55:07.000,
957,3220,MANUFACTURE OF MUSICAL INSTRUMENTS,9998,2016-03-03 14:55:07.000,9998,2016-03-03 14:55:07.000,
958,32201,MANUFACTURE OF GUITARS,9998,2016-03-03 14:55:07.000,9998,2016-03-03 14:55:07.000,
959,32202,"MANUFACTURE OF STRING INSTRUMENTS, OTHER THAN GUITARS",9998,2016-03-03 14:55:07.000,9998,2016-03-03 14:55:07.000,
960,32203,MANUFACTURE OF PIANOS,9998,2016-03-03 14:55:07.000,9998,2016-03-03 14:55:07.000,
961,32204,MANUFACTURE OF MUSICAL ORGANS (ALL TYPES),9998,2016-03-03 14:55:07.000,9998,2016-03-03 14:55:07.000,
962,32205,MANUFACTURE OF WIND AND PERCUSSION INSTRUMENTS,9998,2016-03-03 14:55:07.000,9998,2016-03-03 14:55:07.000,
963,32206,MANUFACTURE OF INSTRUMENT PARTS AND ACCESSORIES,9998,2016-03-03 14:55:07.000,9998,2016-03-03 14:55:07.000,
964,32209,"MANUFACTURE OF MUSICAL INSTRUMENTS, N.E.C.",9998,2016-03-03 14:55:07.000,9998,2016-03-03 14:55:07.000,
965,323,MANUFACTURE OF SPORTS GOODS,9998,2016-03-03 14:55:07.000,9998,2016-03-03 14:55:07.000,
966,3230,MANUFACTURE OF SPORTS GOODS,9998,2016-03-03 14:55:07.000,9998,2016-03-03 14:55:07.000,
967,32301,MANUFACTURE OF SPORTING GLOVES AND MITTS,9998,2016-03-03 14:55:07.000,9998,2016-03-03 14:55:07.000,
968,32302,MANUFACTURE OF SPORTING BALLS,9998,2016-03-03 14:55:07.000,9998,2016-03-03 14:55:07.000,
969,32309,"MANUFACTURE OF SPORTING AND ATHLETIC GOODS, N.E.C.",9998,2016-03-03 14:55:07.000,9998,2016-03-03 14:55:07.000,
970,324,MANUFACTURE OF GAMES AND TOYS,9998,2016-03-03 14:55:07.000,9998,2016-03-03 14:55:07.000,
971,3240,MANUFACTURE OF GAMES AND TOYS,9998,2016-03-03 14:55:07.000,9998,2016-03-03 14:55:07.000,
972,32401,MANUFACTURE OF DOLLS AND DOLL GARMENTS,9998,2016-03-03 14:55:07.000,9998,2016-03-03 14:55:07.000,
973,32402,MANUFACTURE OF WHEELED TOYS,9998,2016-03-03 14:55:07.000,9998,2016-03-03 14:55:07.000,
974,32403,"MANUFACTURE OF BILLIARD, POOL, BOWLING ALLEY AND SIMILAR GAMES EQUIPMENT",9998,2016-03-03 14:55:07.000,9998,2016-03-03 14:55:07.000,
975,32404,"MANUFACTURE OF ELECTRONIC GAMES (VIDEO GAMES, CHECKERS)",9998,2016-03-03 14:55:07.000,9998,2016-03-03 14:55:07.000,
976,32409,"MANUFACTURE OF TOYS AND GAMES, N.E.C.",9998,2016-03-03 14:55:07.000,9998,2016-03-03 14:55:07.000,
977,325,MANUFACTURE OF MEDICAL AND DENTAL INSTRUMENTS AND SUPPLIES,9998,2016-03-03 14:55:07.000,9998,2016-03-03 14:55:07.000,
978,3250,MANUFACTURE OF MEDICAL AND DENTAL INSTRUMENTS AND SUPPLIES,9998,2016-03-03 14:55:07.000,9998,2016-03-03 14:55:07.000,
979,32501,"MANUFACTURE OF MEDICAL, SURGICAL, DENTAL FURNITURE AND FIXTURES",9998,2016-03-03 14:55:07.000,9998,2016-03-03 14:55:07.000,
980,32502,"MANUFACTURE OF OPTHALMIC GOODS, EYEGLASSES, SUNGLASSES, LENSES GROUND TO PRESCRIPTION, CONTACT LENSES, SAFETY GOGGLES",9998,2016-03-03 14:55:07.000,9998,2016-03-03 14:55:07.000,
981,32503,"MANUFACTURE OF PROSTHETIC APPLIANCES, ARTIFICIAL TEETH MADE TO ORDER",9998,2016-03-03 14:55:07.000,9998,2016-03-03 14:55:07.000,
982,32504,MANUFACTURE OF MEDICAL AND PRECISION INSTRUMENTS,9998,2016-03-03 14:55:07.000,9998,2016-03-03 14:55:07.000,
983,32505,MANUFACTURE OF TEMPERATURE MEASURING AND CONTROLLING HYGROMETRIC INSTRUMENTS,9998,2016-03-03 14:55:07.000,9998,2016-03-03 14:55:07.000,
984,32506,MANUFACTURE OF CEMENT USED IN DENTISTRY,9998,2016-03-03 14:55:07.000,9998,2016-03-03 14:55:07.000,
985,32509,"MANUFACTURE OF OTHER MEDICAL AND DENTAL INSTRUMENTS AND SUPPLIES, N.E.C.",9998,2016-03-03 14:55:07.000,9998,2016-03-03 14:55:07.000,
986,329,"OTHER MANUFACTURING, N.E.C.",9998,2016-03-03 14:55:07.000,9998,2016-03-03 14:55:07.000,
987,3291,MANUFACTURE OF PENS AND PENCILS OF ALL KINDS,9998,2016-03-03 14:55:07.000,9998,2016-03-03 14:55:07.000,
988,32910,MANUFACTURE OF PENS AND PENCILS OF ALL KINDS,9998,2016-03-03 14:55:07.000,9998,2016-03-03 14:55:07.000,
989,3292,"MANUFACTURE OF UMBRELLAS, WALKING STICKS, CANES, WHIPS AND RIDING CROPS",9998,2016-03-03 14:55:07.000,9998,2016-03-03 14:55:07.000,
990,32920,"MANUFACTURE OF UMBRELLAS, WALKING STICKS, CANES, WHIPS AND RIDING CROPS",9998,2016-03-03 14:55:07.000,9998,2016-03-03 14:55:07.000,
991,3293,"MANUFACTURE OF ARTICLES FOR PERSONAL USE, E.G. SMOKING PIPES, COMBS, SLIDES AND SIMILAR ARTICLES",9998,2016-03-03 14:55:07.000,9998,2016-03-03 14:55:07.000,
992,32930,"MANUFACTURE OF ARTICLES FOR PERSONAL USE, E.G. SMOKING PIPES, COMBS, SLIDES AND SIMILAR ARTICLES",9998,2016-03-03 14:55:07.000,9998,2016-03-03 14:55:07.000,
993,3294,MANUFACTURE OF CANDLES,9998,2016-03-03 14:55:07.000,9998,2016-03-03 14:55:07.000,
994,32940,MANUFACTURE OF CANDLES,9998,2016-03-03 14:55:07.000,9998,2016-03-03 14:55:07.000,
995,3295,"MANUFACTURE OF ARTIFICIAL FLOWERS, FRUITS AND FOLIAGE",9998,2016-03-03 14:55:07.000,9998,2016-03-03 14:55:07.000,
996,32950,"MANUFACTURE OF ARTIFICIAL FLOWERS, FRUITS AND FOLIAGE",9998,2016-03-03 14:55:07.000,9998,2016-03-03 14:55:07.000,
997,3296,MANUFACTURE OF BURIAL COFFIN,9998,2016-03-03 14:55:07.000,9998,2016-03-03 14:55:07.000,
998,32961,MANUFACTURE OF WOODEN COFFIN,9998,2016-03-03 14:55:07.000,9998,2016-03-03 14:55:07.000,
999,32962,MANUFACTURE OF METAL COFFIN,9998,2016-03-03 14:55:07.000,9998,2016-03-03 14:55:07.000,
1000,3299,"MANUFACTURE OF OTHER MISCELLANEOUS ARTICLES, N.E.C.",9998,2016-03-03 14:55:07.000,9998,2016-03-03 14:55:07.000,
1001,32991,"MANUFACTURE OF BUTTONS, EXCEPT PLASTIC",9998,2016-03-03 14:55:07.000,9998,2016-03-03 14:55:07.000,
1002,32992,"MANUFACTURE OF BROOMS, BRUSHES AND FANS",9998,2016-03-03 14:55:07.000,9998,2016-03-03 14:55:07.000,
1003,32993,"MANUFACTURE OF IDENTIFICATION PLATES, BADGES, EMBLEMS AND TAGS",9998,2016-03-03 14:55:07.000,9998,2016-03-03 14:55:07.000,
1004,32994,MANUFACTURE OF SIGNS AND ADVERTISING DISPLAYS,9998,2016-03-03 14:55:07.000,9998,2016-03-03 14:55:07.000,
1005,32995,MANUFACTURE OF CIGARETTE LIGHTERS,9998,2016-03-03 14:55:07.000,9998,2016-03-03 14:55:07.000,
1006,32999,"MANUFACTURE OF MISCELLANEOUS ARTICLES, N.E.C.",9998,2016-03-03 14:55:07.000,9998,2016-03-03 14:55:07.000,
1007,331,"REPAIR OF FABRICATED METAL PRODUCTS, MACHINERY AND EQUIPMENT",9998,2016-03-03 14:55:07.000,9998,2016-03-03 14:55:07.000,
1008,3311,REPAIR OF FABRICATED METAL PRODUCTS,9998,2016-03-03 14:55:07.000,9998,2016-03-03 14:55:07.000,
1009,33110,REPAIR OF FABRICATED METAL PRODUCTS,9998,2016-03-03 14:55:07.000,9998,2016-03-03 14:55:07.000,
1010,3312,REPAIR OF MACHINERY,9998,2016-03-03 14:55:07.000,9998,2016-03-03 14:55:07.000,
1011,33120,REPAIR OF MACHINERY,9998,2016-03-03 14:55:07.000,9998,2016-03-03 14:55:07.000,
1012,3313,REPAIR OF ELECTRONIC AND OPTICAL EQUIPMENT,9998,2016-03-03 14:55:07.000,9998,2016-03-03 14:55:07.000,
1013,33130,REPAIR OF ELECTRONIC AND OPTICAL EQUIPMENT,9998,2016-03-03 14:55:07.000,9998,2016-03-03 14:55:07.000,
1014,3314,REPAIR OF ELECTRICAL EQUIPMENT,9998,2016-03-03 14:55:07.000,9998,2016-03-03 14:55:07.000,
1015,33140,REPAIR OF ELECTRICAL EQUIPMENT,9998,2016-03-03 14:55:07.000,9998,2016-03-03 14:55:07.000,
1016,3315,"REPAIR OF TRANSPORT EQUIPMENT, EXCEPT MOTOR VEHICLES",9998,2016-03-03 14:55:07.000,9998,2016-03-03 14:55:07.000,
1017,33151,REPAIRING OF SHIPS AND BOATS OTHER THAN SPORTS AND PLEASURE BOATS,9998,2016-03-03 14:55:07.000,9998,2016-03-03 14:55:07.000,
1018,33152,REPAIRING OF SPORTS AND PLEASURE BOATS,9998,2016-03-03 14:55:07.000,9998,2016-03-03 14:55:07.000,
1019,33159,"REPAIR OF TRANSPORT EQUIPMENT, EXCEPT MOTOR VEHICLES, N.E.C.",9998,2016-03-03 14:55:07.000,9998,2016-03-03 14:55:07.000,
1020,3319,REPAIR OF OTHER EQUIPMENT,9998,2016-03-03 14:55:07.000,9998,2016-03-03 14:55:07.000,
1021,33190,REPAIR OF OTHER EQUIPMENT,9998,2016-03-03 14:55:07.000,9998,2016-03-03 14:55:07.000,
1022,332,INSTALLATION OF INDUSTRIAL MACHINERY AND EQUIPMENT,9998,2016-03-03 14:55:07.000,9998,2016-03-03 14:55:07.000,
1023,3320,INSTALLATION OF INDUSTRIAL MACHINERY AND EQUIPMENT,9998,2016-03-03 14:55:07.000,9998,2016-03-03 14:55:07.000,
1024,33200,INSTALLATION OF INDUSTRIAL MACHINERY AND EQUIPMENT,9998,2016-03-03 14:55:07.000,9998,2016-03-03 14:55:07.000,
1025,351,"ELECTRIC POWER GENERATION, TRANSMISSION AND DISTRIBUTION",9998,2016-03-03 14:55:07.000,9998,2016-03-03 14:55:07.000,
1026,3510,"ELECTRIC POWER GENERATION, TRANSMISSION AND DISTRIBUTION",9998,2016-03-03 14:55:07.000,9998,2016-03-03 14:55:07.000,
1027,35100,"ELECTRIC POWER GENERATION, TRANSMISSION AND DISTRIBUTION",9998,2016-03-03 14:55:07.000,9998,2016-03-03 14:55:07.000,
1028,352,MANUFACTURE OF GAS; DISTRIBUTION OF GASEOUS FUELS THROUGH MAINS,9998,2016-03-03 14:55:07.000,9998,2016-03-03 14:55:07.000,
1029,3520,MANUFACTURE OF GAS; DISTRIBUTION OF GASEOUS FUELS THROUGH MAINS,9998,2016-03-03 14:55:07.000,9998,2016-03-03 14:55:07.000,
1030,35200,MANUFACTURE OF GAS; DISTRIBUTION OF GASEOUS FUELS THROUGH MAINS,9998,2016-03-03 14:55:07.000,9998,2016-03-03 14:55:07.000,
1031,353,"STEAM, AIR CONDITIONING SUPPLY AND PRODUCTION OF ICE",9998,2016-03-03 14:55:07.000,9998,2016-03-03 14:55:07.000,
1032,3530,"STEAM, AIR CONDITIONING SUPPLY AND PRODUCTION OF ICE",9998,2016-03-03 14:55:07.000,9998,2016-03-03 14:55:07.000,
1033,35300,"STEAM, AIR CONDITIONING SUPPLY AND PRODUCTION OF ICE",9998,2016-03-03 14:55:07.000,9998,2016-03-03 14:55:07.000,
1034,360,"WATER COLLECTION, TREATMENT AND SUPPLY",9998,2016-03-03 14:55:07.000,9998,2016-03-03 14:55:07.000,
1035,3600,"WATER COLLECTION, TREATMENT AND SUPPLY",9998,2016-03-03 14:55:07.000,9998,2016-03-03 14:55:07.000,
1036,36000,"WATER COLLECTION, TREATMENT AND SUPPLY",9998,2016-03-03 14:55:07.000,9998,2016-03-03 14:55:07.000,
1037,370,SEWERAGE,9998,2016-03-03 14:55:07.000,9998,2016-03-03 14:55:07.000,
1038,3700,SEWERAGE,9998,2016-03-03 14:55:07.000,9998,2016-03-03 14:55:07.000,
1039,37000,SEWERAGE,9998,2016-03-03 14:55:07.000,9998,2016-03-03 14:55:07.000,
1040,381,WASTE COLLECTION,9998,2016-03-03 14:55:07.000,9998,2016-03-03 14:55:07.000,
1041,3811,COLLECTION OF NON-HAZARDOUS WASTE,9998,2016-03-03 14:55:07.000,9998,2016-03-03 14:55:07.000,
1042,38110,COLLECTION OF NON-HAZARDOUS WASTE,9998,2016-03-03 14:55:07.000,9998,2016-03-03 14:55:07.000,
1043,3812,COLLECTION OF HAZARDOUS WASTE,9998,2016-03-03 14:55:07.000,9998,2016-03-03 14:55:07.000,
1044,38120,COLLECTION OF HAZARDOUS WASTE,9998,2016-03-03 14:55:07.000,9998,2016-03-03 14:55:07.000,
1045,382,WASTE TREATMENT AND DISPOSAL,9998,2016-03-03 14:55:07.000,9998,2016-03-03 14:55:07.000,
1046,3821,TREATMENT AND DISPOSAL OF NON-HAZARDOUS WASTE,9998,2016-03-03 14:55:07.000,9998,2016-03-03 14:55:07.000,
1047,38210,TREATMENT AND DISPOSAL OF NON-HAZARDOUS WASTE,9998,2016-03-03 14:55:07.000,9998,2016-03-03 14:55:07.000,
1048,3822,TREATMENT AND DISPOSAL OF HAZARDOUS WASTE,9998,2016-03-03 14:55:07.000,9998,2016-03-03 14:55:07.000,
1049,38220,TREATMENT AND DISPOSAL OF HAZARDOUS WASTE,9998,2016-03-03 14:55:07.000,9998,2016-03-03 14:55:07.000,
1050,383,MATERIALS RECOVERY,9998,2016-03-03 14:55:07.000,9998,2016-03-03 14:55:07.000,
1051,3830,MATERIALS RECOVERY,9998,2016-03-03 14:55:07.000,9998,2016-03-03 14:55:07.000,
1052,38300,MATERIALS RECOVERY,9998,2016-03-03 14:55:07.000,9998,2016-03-03 14:55:07.000,
1053,390,REMEDIATION ACTIVITIES AND OTHER WASTE MANAGEMENT SERVICES,9998,2016-03-03 14:55:07.000,9998,2016-03-03 14:55:07.000,
1054,3900,REMEDIATION ACTIVITIES AND OTHER WASTE MANAGEMENT SERVICES,9998,2016-03-03 14:55:07.000,9998,2016-03-03 14:55:07.000,
1055,39000,REMEDIATION ACTIVITIES AND OTHER WASTE MANAGEMENT SERVICES,9998,2016-03-03 14:55:07.000,9998,2016-03-03 14:55:07.000,
1056,410,CONSTRUCTION OF BUILDINGS,9998,2016-03-03 14:55:07.000,9998,2016-03-03 14:55:07.000,
1057,4100,CONSTRUCTION OF BUILDINGS,9998,2016-03-03 14:55:07.000,9998,2016-03-03 14:55:07.000,
1058,41001,RESIDENTIAL (DWELLING) BUILDING CONSTRUCTIONS,9998,2016-03-03 14:55:07.000,9998,2016-03-03 14:55:07.000,
1059,41002,NON-RESIDENTIAL BUILDING CONSTRUCTIONS,9998,2016-03-03 14:55:07.000,9998,2016-03-03 14:55:07.000,
1060,421,CONSTRUCTION OF ROADS AND RAILWAYS,9998,2016-03-03 14:55:07.000,9998,2016-03-03 14:55:07.000,
1061,4210,CONSTRUCTION OF ROADS AND RAILWAYS,9998,2016-03-03 14:55:07.000,9998,2016-03-03 14:55:07.000,
1062,42100,CONSTRUCTION OF ROADS AND RAILWAYS,9998,2016-03-03 14:55:07.000,9998,2016-03-03 14:55:07.000,
1063,422,CONSTRUCTION OF UTILITY PROJECTS,9998,2016-03-03 14:55:07.000,9998,2016-03-03 14:55:07.000,
1064,4220,CONSTRUCTION OF UTILITY PROJECTS,9998,2016-03-03 14:55:07.000,9998,2016-03-03 14:55:07.000,
1065,42200,CONSTRUCTION OF UTILITY PROJECTS,9998,2016-03-03 14:55:07.000,9998,2016-03-03 14:55:07.000,
1066,429,CONSTRUCTION OF OTHER CIVIL ENGINEERING PROJECTS,9998,2016-03-03 14:55:07.000,9998,2016-03-03 14:55:07.000,
1067,4290,CONSTRUCTION OF OTHER CIVIL ENGINEERING PROJECTS,9998,2016-03-03 14:55:07.000,9998,2016-03-03 14:55:07.000,
1068,42900,CONSTRUCTION OF OTHER CIVIL ENGINEERING PROJECTS,9998,2016-03-03 14:55:07.000,9998,2016-03-03 14:55:07.000,
1069,431,DEMOLITION AND SITE PREPARATION,9998,2016-03-03 14:55:07.000,9998,2016-03-03 14:55:07.000,
1070,4311,DEMOLITION,9998,2016-03-03 14:55:07.000,9998,2016-03-03 14:55:07.000,
1071,43110,DEMOLITION,9998,2016-03-03 14:55:07.000,9998,2016-03-03 14:55:07.000,
1072,4312,SITE PREPARATION,9998,2016-03-03 14:55:07.000,9998,2016-03-03 14:55:07.000,
1073,43120,SITE PREPARATION,9998,2016-03-03 14:55:07.000,9998,2016-03-03 14:55:07.000,
1074,432,"ELECTRICAL, PLUMBING AND OTHER CONSTRUCTION INSTALLATION ACTIVITIES",9998,2016-03-03 14:55:07.000,9998,2016-03-03 14:55:07.000,
1075,4321,ELECTRICAL INSTALLATION,9998,2016-03-03 14:55:07.000,9998,2016-03-03 14:55:07.000,
1076,43210,ELECTRICAL INSTALLATION,9998,2016-03-03 14:55:07.000,9998,2016-03-03 14:55:07.000,
1077,4322,"PLUMBING, HEAT AND AIR-CONDITIONING INSTALLATION",9998,2016-03-03 14:55:07.000,9998,2016-03-03 14:55:07.000,
1078,43220,"PLUMBING, HEAT AND AIR-CONDITIONING INSTALLATION",9998,2016-03-03 14:55:07.000,9998,2016-03-03 14:55:07.000,
1079,4329,OTHER CONSTRUCTION INSTALLATION,9998,2016-03-03 14:55:07.000,9998,2016-03-03 14:55:07.000,
1080,43290,OTHER CONSTRUCTION INSTALLATION,9998,2016-03-03 14:55:07.000,9998,2016-03-03 14:55:07.000,
1081,433,BUILDING COMPLETION AND FINISHING,9998,2016-03-03 14:55:07.000,9998,2016-03-03 14:55:07.000,
1082,4330,BUILDING COMPLETION AND FINISHING,9998,2016-03-03 14:55:07.000,9998,2016-03-03 14:55:07.000,
1083,43301,PAINTING AND RELATED WORK,9998,2016-03-03 14:55:07.000,9998,2016-03-03 14:55:07.000,
1084,43302,FLOOR AND WALL TILING OR COVERING WITH OTHER MATERIAL,9998,2016-03-03 14:55:07.000,9998,2016-03-03 14:55:07.000,
1085,F434324330,CARPENTRY,9998,2016-03-03 14:55:07.000,8888,2018-07-17 15:58:15.100,
1086,43309,OTHER BUILDING COMPLETION AND FINISHING ACTIVITIES,9998,2016-03-03 14:55:07.000,9998,2016-03-03 14:55:07.000,
1087,439,OTHER SPECIALIZED CONSTRUCTION ACTIVITIES,9998,2016-03-03 14:55:07.000,9998,2016-03-03 14:55:07.000,
1088,4390,OTHER SPECIALIZED CONSTRUCTION ACTIVITIES,9998,2016-03-03 14:55:07.000,9998,2016-03-03 14:55:07.000,
